{
 "$schema": "fos-page.schema.json",
 "schemaVersion": 1,
 "id": "erpview",
 "title": "ERP (embedded)",
 "subtitle": "How an ERP page appears inside FOS today: the FOS menu, top bar and footer around the ERP panel, which is styled to look like FOS.",
 "workspace": "10-administration",
 "package": null,
 "origin": "generated",
 "actions": [
  {
   "label": "Open the real ERP panel",
   "style": "btn-secondary",
   "onclick": "window.open(document.getElementById('erpFrame').dataset.full,'_blank')",
   "icon": "external-link"
  }
 ],
 "kpis": {
  "type": "kpis",
  "items": [
   {
    "label": "ERP plugins",
    "value": "9",
    "accent": "purple"
   },
   {
    "label": "Link mode",
    "value": "Embedded",
    "accent": "blue"
   },
   {
    "label": "Same login",
    "value": "Yes",
    "accent": "green"
   }
  ]
 },
 "tabs": [
  {
   "id": "erpview-tab-view",
   "label": "ERP page",
   "source": "schema",
   "blocks": [
    {
     "type": "html",
     "title": "ERP inside the FOS shell",
     "icon": "layers",
     "sub": "Used today for every ERP plugin. Each page here is a candidate to port as a VendorOS page.",
     "html": "<div class=\"page-actions\" style=\"margin-bottom:10px\"><select id=\"erpPick\" onchange=\"erpOpen(this.value)\" style=\"padding:6px 8px;border:1.5px solid var(--border);border-radius:8px;background:var(--surface-2)\"><option value=\"/erp/accounts\">accounts</option><option value=\"/erp/employees/employees\">employees</option><option value=\"/erp/inventory/overview\">inventories</option><option value=\"/erp/invoices/customers/invoices\">invoices</option><option value=\"/erp/maintenance/maintenance/requests\">maintenance</option><option value=\"/erp/manufacturing/operations/manufacturing-orders\">manufacturing</option><option value=\"/erp/products\">products</option><option value=\"/erp/purchase/orders/purchase-orders\">purchases</option><option value=\"/erp\">sales</option></select> <button class=\"btn btn-secondary btn-sm\" onclick=\"erpOpen(erpPick.value)\">Reload</button> <a id=\"erpFull\" href=\"erp\" target=\"_blank\" rel=\"noopener\" style=\"font-size:12.5px\">Open full ERP panel</a></div><iframe id=\"erpFrame\" title=\"ERP\" data-full=\"erp\" style=\"width:100%;height:640px;border:0;background:transparent\"></iframe><p style=\"font-size:12px;color:var(--muted);margin-top:8px\">This is the same page FOS shows at admin/erp-view. It needs the FOS login in this browser. The ERP panel hides its own menu and top bar when framed (embedded=1).</p>"
    }
   ]
  }
 ]
}